{
  "claim_number": "CLM-2024-567890",
  "policy_number": "AIG-GL-2024-001234",
  "loss_date": "2024-06-15",
  "reported_date": "2024-06-17",
  "loss_description": "Property damage due to fire in warehouse facility",
  "loss_amount": 250000.0,
  "claim_status": "Under Investigation",
  "adjuster_name": "Jane Smith"
}